{
  "$schema": "../schema/native-toolchain-lock.schema.json",
  "schemaId": "local-whisper-native-toolchain-lock-v1",
  "profileId": "linux-x64-clang-18.1.3-asan-ubsan-v1",
  "target": {
    "os": "linux",
    "architecture": "x64",
    "abi": "ubuntu-24.04-glibc-2.39"
  },
  "tools": [
    {
      "role": "c-compiler",
      "pathKind": "toolchainRootRelative",
      "path": "clang-18.1.3/usr/lib/llvm-18/bin/clang",
      "version": "Ubuntu clang version 18.1.3",
      "sha256": "8ef402d453d1ba4902e4ee0f0f847f6cfa01400c95aa43c24e97818b9c0e3f45"
    },
    {
      "role": "cxx-compiler",
      "pathKind": "toolchainRootRelative",
      "path": "clang-18.1.3/usr/lib/llvm-18/bin/clang++",
      "version": "Ubuntu clang version 18.1.3",
      "sha256": "8ef402d453d1ba4902e4ee0f0f847f6cfa01400c95aa43c24e97818b9c0e3f45"
    },
    {
      "role": "linker",
      "pathKind": "toolchainRootRelative",
      "path": "clang-18.1.3/usr/lib/llvm-18/bin/ld.lld",
      "version": "LLD 18.1.3",
      "sha256": "7ad9a0e8fe6d0e79b71172d731e33872c0274e49fceb7b516d774876d5a58ade"
    },
    {
      "role": "archiver",
      "pathKind": "toolchainRootRelative",
      "path": "clang-18.1.3/usr/lib/llvm-18/bin/llvm-ar",
      "version": "LLVM version 18.1.3",
      "sha256": "eedd2efbdee80acf60e17e10adeddf31be0347226245f935be95efa3ae00ec79"
    },
    {
      "role": "ranlib",
      "pathKind": "toolchainRootRelative",
      "path": "clang-18.1.3/usr/lib/llvm-18/bin/llvm-ranlib",
      "version": "LLVM version 18.1.3",
      "sha256": "eedd2efbdee80acf60e17e10adeddf31be0347226245f935be95efa3ae00ec79"
    },
    {
      "role": "cmake",
      "pathKind": "toolchainRootRelative",
      "path": "cmake-3.31.8/bin/cmake",
      "version": "cmake version 3.31.8",
      "sha256": "8df68e8be95c6e8f7c329b24f38fd209dc6f57f2f22433d0f81bd43a31a8744d"
    },
    {
      "role": "ninja",
      "pathKind": "toolchainRootRelative",
      "path": "ninja-1.12.1/ninja",
      "version": "1.12.1",
      "sha256": "cf10a35d13a384fed866bcd4989c7761e8556209d195cc6d2a7c0f11cc73804c"
    },
    {
      "role": "elf-inspector",
      "pathKind": "systemAbsolute",
      "path": "/usr/bin/x86_64-linux-gnu-readelf",
      "version": "GNU readelf (GNU Binutils for Ubuntu) 2.42",
      "sha256": "64c58e15274bbbb5153f31078e455e9e77ee5f51489e709bba5bb788ce9df2b0"
    },
    {
      "role": "network-harness",
      "pathKind": "systemAbsolute",
      "path": "/usr/bin/unshare",
      "version": "unshare from util-linux 2.39.3",
      "sha256": "51bcc77ba5db162c80028f861f0a2770d728c1de80773816d863f28d7a817adb"
    },
    {
      "role": "network-probe-runtime",
      "pathKind": "systemAbsolute",
      "path": "/usr/bin/python3.12",
      "version": "Python 3.12.3",
      "sha256": "1643dacd9feaedc58f3cc581e4d22577dfe25c09b10282936186ccf0f2e61118"
    }
  ],
  "runtime": [
    {
      "id": "clang-asan-18.1.3",
      "pathKind": "toolchainRootRelative",
      "path": "clang-18.1.3/usr/lib/llvm-18/lib/clang/18/lib/linux/libclang_rt.asan-x86_64.so",
      "sha256": "221c945e3742ba52aa7de6924f7008fc51bb8e84068404ea62924ca7f05b9335"
    },
    {
      "id": "clang-ubsan-18.1.3",
      "pathKind": "toolchainRootRelative",
      "path": "clang-18.1.3/usr/lib/llvm-18/lib/clang/18/lib/linux/libclang_rt.ubsan_standalone-x86_64.so",
      "sha256": "c02e56cac9f8fc6886db10d662e2ff7b007525585d3f984323cda31c8432b9da"
    },
    {
      "id": "libstdcxx-gcc-13",
      "pathKind": "systemAbsolute",
      "path": "/usr/lib/x86_64-linux-gnu/libstdc++.so.6.0.33",
      "sha256": "1fd75fe70354a416d75aef22bcae68c47bd25d20e2d0568c30b1a9838cf62f11"
    },
    {
      "id": "libgcc-s-gcc-13",
      "pathKind": "systemAbsolute",
      "path": "/usr/lib/x86_64-linux-gnu/libgcc_s.so.1",
      "sha256": "d93224d2b0dab4247598be683adca02f5cf00586f99c187579cd7e92058fb7cb"
    },
    {
      "id": "glibc-2.39",
      "pathKind": "systemAbsolute",
      "path": "/usr/lib/x86_64-linux-gnu/libc.so.6",
      "sha256": "8db37cf3f2169f59a0f07ef1fea308c35656668c64c8ff294e1860f4121eb161"
    },
    {
      "id": "libm-glibc-2.39",
      "pathKind": "systemAbsolute",
      "path": "/usr/lib/x86_64-linux-gnu/libm.so.6",
      "sha256": "e9c4b28d340e415b8137480ec442662f981e1399386c5931dae0e886e3639e91"
    },
    {
      "id": "ld-linux-glibc-2.39",
      "pathKind": "systemAbsolute",
      "path": "/usr/lib/x86_64-linux-gnu/ld-linux-x86-64.so.2",
      "sha256": "cd4df4f3c7b83673d61189bf2eaebd33ca4f2853ab9772b8a25e025ef99b1e81"
    }
  ],
  "architectureTargets": ["x86-64-sse2"],
  "environmentAllowlist": ["ASAN_OPTIONS", "LANG", "LC_ALL", "PATH", "UBSAN_OPTIONS"],
  "sourceLockIds": [],
  "patchLockIds": [],
  "qualificationFixture": {
    "fixtureId": "local-whisper-sanitizer-proof-v1",
    "manifestSha256": "10c616c610107c608f00e79a1ec737f601c70fe7706341ff2998457607a4a4e7"
  },
  "cmakeCache": {
    "CMAKE_BUILD_TYPE": "Debug",
    "CMAKE_AR": "toolchainRoot:clang-18.1.3/usr/lib/llvm-18/bin/llvm-ar",
    "CMAKE_CXX_FLAGS": "-Wall -Wextra -Werror -fno-omit-frame-pointer",
    "CMAKE_CXX_SCAN_FOR_MODULES": "OFF",
    "CMAKE_CXX_STANDARD": "20",
    "CMAKE_EXE_LINKER_FLAGS": "-fuse-ld=lld",
    "CMAKE_EXPORT_COMPILE_COMMANDS": "ON",
    "CMAKE_LINKER": "toolchainRoot:clang-18.1.3/usr/lib/llvm-18/bin/ld.lld",
    "CMAKE_RANLIB": "toolchainRoot:clang-18.1.3/usr/lib/llvm-18/bin/llvm-ranlib",
    "CMAKE_SKIP_BUILD_RPATH": "ON",
    "FETCHCONTENT_FULLY_DISCONNECTED": "ON"
  },
  "expectedBuildGraph": [
    "local-whisper-sanitizer-clean",
    "local-whisper-sanitizer-asan-trigger",
    "local-whisper-sanitizer-ubsan-trigger"
  ],
  "outputs": [
    {
      "id": "sanitizer-clean",
      "pathKind": "outputRelative",
      "path": "bin/local-whisper-sanitizer-clean",
      "sha256": null
    },
    {
      "id": "sanitizer-asan-trigger",
      "pathKind": "outputRelative",
      "path": "bin/local-whisper-sanitizer-asan-trigger",
      "sha256": null
    },
    {
      "id": "sanitizer-ubsan-trigger",
      "pathKind": "outputRelative",
      "path": "bin/local-whisper-sanitizer-ubsan-trigger",
      "sha256": null
    }
  ],
  "dynamicDependencies": [
    {
      "id": "clang-asan-18.1.3",
      "pathKind": "toolchainRootRelative",
      "path": "clang-18.1.3/usr/lib/llvm-18/lib/clang/18/lib/linux/libclang_rt.asan-x86_64.so",
      "sha256": "221c945e3742ba52aa7de6924f7008fc51bb8e84068404ea62924ca7f05b9335",
      "soname": "libclang_rt.asan-x86_64.so"
    },
    {
      "id": "clang-ubsan-18.1.3",
      "pathKind": "toolchainRootRelative",
      "path": "clang-18.1.3/usr/lib/llvm-18/lib/clang/18/lib/linux/libclang_rt.ubsan_standalone-x86_64.so",
      "sha256": "c02e56cac9f8fc6886db10d662e2ff7b007525585d3f984323cda31c8432b9da",
      "soname": "libclang_rt.ubsan_standalone-x86_64.so"
    },
    {
      "id": "libstdcxx-gcc-13",
      "pathKind": "systemAbsolute",
      "path": "/usr/lib/x86_64-linux-gnu/libstdc++.so.6.0.33",
      "sha256": "1fd75fe70354a416d75aef22bcae68c47bd25d20e2d0568c30b1a9838cf62f11",
      "soname": "libstdc++.so.6"
    },
    {
      "id": "libgcc-s-gcc-13",
      "pathKind": "systemAbsolute",
      "path": "/usr/lib/x86_64-linux-gnu/libgcc_s.so.1",
      "sha256": "d93224d2b0dab4247598be683adca02f5cf00586f99c187579cd7e92058fb7cb",
      "soname": "libgcc_s.so.1"
    },
    {
      "id": "glibc-2.39",
      "pathKind": "systemAbsolute",
      "path": "/usr/lib/x86_64-linux-gnu/libc.so.6",
      "sha256": "8db37cf3f2169f59a0f07ef1fea308c35656668c64c8ff294e1860f4121eb161",
      "soname": "libc.so.6"
    },
    {
      "id": "libm-glibc-2.39",
      "pathKind": "systemAbsolute",
      "path": "/usr/lib/x86_64-linux-gnu/libm.so.6",
      "sha256": "e9c4b28d340e415b8137480ec442662f981e1399386c5931dae0e886e3639e91",
      "soname": "libm.so.6"
    },
    {
      "id": "ld-linux-glibc-2.39",
      "pathKind": "systemAbsolute",
      "path": "/usr/lib/x86_64-linux-gnu/ld-linux-x86-64.so.2",
      "sha256": "cd4df4f3c7b83673d61189bf2eaebd33ca4f2853ab9772b8a25e025ef99b1e81",
      "soname": "ld-linux-x86-64.so.2"
    }
  ],
  "licenses": [
    {
      "id": "llvm-apache-2-exception",
      "pathKind": "toolchainRootRelative",
      "path": "clang-18.1.3/LICENSE.TXT",
      "sha256": "837f5d6ac67c8f7a5f43bf675a0f8afc1564600ebdc6f350411bc5dd790c2eda"
    },
    {
      "id": "cmake-bsd-3.31.8",
      "pathKind": "toolchainRootRelative",
      "path": "cmake-3.31.8/doc/cmake/Copyright.txt",
      "sha256": "0676e30827684487aa0ea8f72f01e9460a6320fa34a2888df0ad1dd3e8a06eb8"
    },
    {
      "id": "ninja-apache-2.0-1.12.1",
      "pathKind": "toolchainRootRelative",
      "path": "ninja-1.12.1/COPYING",
      "sha256": "2a9c9aa5724cdeb0c2eae8bbfcc49aec16f8860775ae5707eb3b76a17446f698"
    }
  ],
  "sbomComponents": ["clang-18.1.3", "lld-18.1.3", "cmake-3.31.8", "ninja-1.12.1"],
  "qualificationState": "qualified",
  "evidenceDigest": "93b001b715b581c7b237b1bd5f8850b9f4209824f6280fb9982c1e47d3a043ca",
  "minimumDriver": null
}
